{
  "$schema":"https://json-schema.org/draft/2020-12/schema", "$id":"urn:most:reporting:report-catalog-activation-input-bundle:v1", "type":"object", "additionalProperties":false,
  "required":["artifact_id","schema_version","status","release_sha","generated_at","source_artifacts","candidate_manifest","candidate_payloads","validation_items","bindings","conformance_records","plan_evidence_documents","counts","section_hashes"],
  "properties":{"artifact_id":{"const":"report_catalog_activation_inputs"},"schema_version":{"const":"1.0.0"},"status":{"const":"activation_inputs_passed"},"release_sha":{"$ref":"#/$defs/sha1"},"generated_at":{"$ref":"#/$defs/timestamp"},"source_artifacts":{"type":"array","minItems":3,"maxItems":3,"items":{"$ref":"#/$defs/artifact"}},"candidate_manifest":{"$ref":"#/$defs/closedObject"},"candidate_payloads":{"type":"array","minItems":28,"maxItems":28,"items":{"$ref":"#/$defs/closedObject"}},"validation_items":{"type":"array","minItems":28,"maxItems":28,"items":{"$ref":"#/$defs/closedObject"}},"bindings":{"type":"array","minItems":28,"maxItems":28,"items":{"$ref":"#/$defs/closedObject"}},"conformance_records":{"type":"array","minItems":28,"maxItems":28,"items":{"$ref":"#/$defs/closedObject"}},"plan_evidence_documents":{"type":"array","minItems":2,"maxItems":2,"items":{"$ref":"#/$defs/closedObject"}},"counts":{"$ref":"#/$defs/counts"},"section_hashes":{"$ref":"#/$defs/sectionHashes"}},
  "$defs":{"sha1":{"type":"string","pattern":"^[a-f0-9]{40}$"},"sha256":{"type":"string","pattern":"^[a-f0-9]{64}$"},"timestamp":{"type":"string","format":"date-time","pattern":"^[0-9]{4}-[0-9]{2}-[0-9]{2}T[0-9]{2}:[0-9]{2}:[0-9]{2}Z$"},"artifact":{"type":"object","additionalProperties":false,"required":["artifact_id","path","schema_path","sha256","schema_sha256"],"properties":{"artifact_id":{"type":"string","pattern":"^[a-z][a-z0-9_]{2,127}$"},"path":{"type":"string","pattern":"^(?!/)(?!.*\\.\\.)[A-Za-z0-9_.\\-/]+$"},"schema_path":{"type":"string","pattern":"^docs/reports/contracts/[A-Za-z0-9_.-]+\\.schema\\.json$"},"sha256":{"$ref":"#/$defs/sha256"},"schema_sha256":{"$ref":"#/$defs/sha256"}}},"closedObject":{"type":"object","additionalProperties":false},"counts":{"type":"object","additionalProperties":false,"required":["plan_2_candidates","plan_3_candidates","candidate_payloads","validation_items","passed_validations","bindings","conformance_records"],"properties":{"plan_2_candidates":{"const":12},"plan_3_candidates":{"const":16},"candidate_payloads":{"const":28},"validation_items":{"const":28},"passed_validations":{"const":28},"bindings":{"const":28},"conformance_records":{"const":28}}},"sectionHashes":{"type":"object","additionalProperties":false,"required":["candidate_manifest","candidate_payloads","validation_items","bindings","conformance_records","plan_evidence_documents"],"properties":{"candidate_manifest":{"$ref":"#/$defs/sha256"},"candidate_payloads":{"$ref":"#/$defs/sha256"},"validation_items":{"$ref":"#/$defs/sha256"},"bindings":{"$ref":"#/$defs/sha256"},"conformance_records":{"$ref":"#/$defs/sha256"},"plan_evidence_documents":{"$ref":"#/$defs/sha256"}}}}
}
