{
  "artifact_id": "report_catalog_activation_inputs",
  "schema_version": "1.0.0",
  "status": "activation_inputs_passed",
  "release_sha": "1111111111111111111111111111111111111111",
  "generated_at": "2026-07-26T00:00:00Z",
  "source_artifacts": [
    {
      "artifact_id": "plan2",
      "path": "build/reports/plan2.json",
      "schema_path": "docs/reports/contracts/report-catalog-activation-input-bundle.schema.json",
      "sha256": "00aaaaaaaaaaaaaaaaaaaaaaaaaaaaaaaaaaaaaaaaaaaaaaaaaaaaaaaaaaaaaa",
      "schema_sha256": "eeeeeeeeeeeeeeeeeeeeeeeeeeeeeeeeeeeeeeeeeeeeeeeeeeeeeeeeeeeeeeee"
    },
    {
      "artifact_id": "plan3a",
      "path": "build/reports/plan3a.json",
      "schema_path": "docs/reports/contracts/report-catalog-activation-input-bundle.schema.json",
      "sha256": "01aaaaaaaaaaaaaaaaaaaaaaaaaaaaaaaaaaaaaaaaaaaaaaaaaaaaaaaaaaaaaa",
      "schema_sha256": "eeeeeeeeeeeeeeeeeeeeeeeeeeeeeeeeeeeeeeeeeeeeeeeeeeeeeeeeeeeeeeee"
    },
    {
      "artifact_id": "plan3b",
      "path": "build/reports/plan3b.json",
      "schema_path": "docs/reports/contracts/report-catalog-activation-input-bundle.schema.json",
      "sha256": "02aaaaaaaaaaaaaaaaaaaaaaaaaaaaaaaaaaaaaaaaaaaaaaaaaaaaaaaaaaaaaa",
      "schema_sha256": "eeeeeeeeeeeeeeeeeeeeeeeeeeeeeeeeeeeeeeeeeeeeeeeeeeeeeeeeeeeeeeee"
    }
  ],
  "candidate_manifest": {},
  "candidate_payloads": [
    {},
    {},
    {},
    {},
    {},
    {},
    {},
    {},
    {},
    {},
    {},
    {},
    {},
    {},
    {},
    {},
    {},
    {},
    {},
    {},
    {},
    {},
    {},
    {},
    {},
    {},
    {},
    {}
  ],
  "validation_items": [
    {},
    {},
    {},
    {},
    {},
    {},
    {},
    {},
    {},
    {},
    {},
    {},
    {},
    {},
    {},
    {},
    {},
    {},
    {},
    {},
    {},
    {},
    {},
    {},
    {},
    {},
    {},
    {}
  ],
  "bindings": [
    {},
    {},
    {},
    {},
    {},
    {},
    {},
    {},
    {},
    {},
    {},
    {},
    {},
    {},
    {},
    {},
    {},
    {},
    {},
    {},
    {},
    {},
    {},
    {},
    {},
    {},
    {},
    {}
  ],
  "conformance_records": [
    {},
    {},
    {},
    {},
    {},
    {},
    {},
    {},
    {},
    {},
    {},
    {},
    {},
    {},
    {},
    {},
    {},
    {},
    {},
    {},
    {},
    {},
    {},
    {},
    {},
    {},
    {},
    {}
  ],
  "plan_evidence_documents": [
    {},
    {}
  ],
  "counts": {
    "plan_2_candidates": 12,
    "plan_3_candidates": 16,
    "candidate_payloads": 28,
    "validation_items": 28,
    "passed_validations": 28,
    "bindings": 28,
    "conformance_records": 28
  },
  "section_hashes": {
    "candidate_manifest": "aaaaaaaaaaaaaaaaaaaaaaaaaaaaaaaaaaaaaaaaaaaaaaaaaaaaaaaaaaaaaaaa",
    "candidate_payloads": "bbbbbbbbbbbbbbbbbbbbbbbbbbbbbbbbbbbbbbbbbbbbbbbbbbbbbbbbbbbbbbbb",
    "validation_items": "cccccccccccccccccccccccccccccccccccccccccccccccccccccccccccccccc",
    "bindings": "dddddddddddddddddddddddddddddddddddddddddddddddddddddddddddddddd",
    "conformance_records": "eeeeeeeeeeeeeeeeeeeeeeeeeeeeeeeeeeeeeeeeeeeeeeeeeeeeeeeeeeeeeeee",
    "plan_evidence_documents": "ffffffffffffffffffffffffffffffffffffffffffffffffffffffffffffffff"
  }
}
